,Datetime,TweetId,location,Media,url,hastag,retweet_count,likeCount,Organization,name,sentiment,topics,summary,geo_country,Country
0,[numpy.datetime64('2022-01-16T14:46:04.000000000')],[1482725846964060163],"['Vancouver, British Columbia']",[[]],['https://twitter.com/user/status/1482725846964060163'],['Doctor Protest'],0,1,['null'],[None],['NEGATIVE'],"[{0: 'caravan ago vancouv open seen', 1: 'caravan mbmch month seen st', 2: 'protest month open main st', 3: 'st caravan vancouv car mbmch', 4: 'main ago st month protest'}]",vancouver mbmch protested up and down main st about six months ago open wi-fi . a car caravan protest was held about a week ago in a caravan protest . it was the first time a van...,"['Vancouver, District of North Vancouver, Metro Vancouver Regional District, British Columbia, Canada']",['Canada']
0,"[numpy.datetime64('2022-01-15T06:45:08.000000000'), numpy.datetime64('2022-01-15T02:27:02.000000000'), numpy.datetime64('2022-01-13T15:12:22.000000000'), numpy.datetime64('2022-01-13T02:12:46.000000000'), numpy.datetime64('2022-01-13T02:12:22.000000000'), numpy.datetime64('2022-01-12T17:55:16.000000000'), numpy.datetime64('2022-01-12T09:25:02.000000000'), numpy.datetime64('2022-01-11T10:44:22.000000000')]","[1482242430657495042, 1482177477762236419, 1481645301341765632, 1481449109261524995, 1481449008497565696, 1481323909119377408, 1481195504734474243, 1480853080891559936]","['', '', '', '', '', '', '', '']","[[], [], [], [], [], [], [], []]","['https://twitter.com/user/status/1482242430657495042', 'https://twitter.com/user/status/1482177477762236419', 'https://twitter.com/user/status/1481645301341765632', 'https://twitter.com/user/status/1481449109261524995', 'https://twitter.com/user/status/1481449008497565696', 'https://twitter.com/user/status/1481323909119377408', 'https://twitter.com/user/status/1481195504734474243', 'https://twitter.com/user/status/1480853080891559936']","['Doctor Protest', 'Doctor Protest', 'Doctor Protest', 'Doctor Protest', 'Doctor Protest', 'Doctor Protest', 'Doctor Protest', 'Doctor Strikes']",13,13,"['null', 'null', 'null', 'null', 'null', 'null', 'null', 'null']","[None, None, 'doctor', 'doctor', 'doctor', None, 'doctor', ['medicos', 'stri']]","['POSITIVE', 'POSITIVE', 'NEGATIVE', 'POSITIVE', 'POSITIVE', 'POSITIVE', 'NEGATIVE', 'NEGATIVE']","[{0: 'gadkari india', 1: 'gadkari india', 2: 'india gadkari', 3: 'gadkari india', 4: 'gadkari india'}, 'null', {0: 'india doctor ghonia say', 1: 'india ghonia say doctor', 2: 'india doctor ghonia say', 3: 'india ghonia say doctor', 4: 'doctor ghonia india say'}, {0: 'india alokmitt doctor', 1: 'india doctor alokmitt', 2: 'alokmitt india doctor', 3: 'doctor alokmitt india', 4: 'india doctor alokmitt'}, {0: 'india alokmitt doctor', 1: 'india doctor alokmitt', 2: 'alokmitt india doctor', 3: 'doctor alokmitt india', 4: 'india doctor alokmitt'}, {0: 'india ntag', 1: 'india ntag', 2: 'ntag india', 3: 'india ntag', 4: 'india ntag'}, {0: 'bright alway lost student india', 1: 'india smile author student govern', 2: 'bright doctor smile lost alway', 3: 'govern bright doctor alway lost', 4: 'bright author govern doctor smile'}, {0: 'doctor act test medico state', 1: 'doctor illeg india state stri', 2: 'posit india medico goi stri', 3: 'stri doctor test covid illeg', 4: 'goi act stri india posit'}]",doctor says india ghonia lost one more doctor a bright student always smiling one rather this is what government and authority has...thousands of doctors medicos test covid positive across india if goi states had acted against illegal doctor stri...,"['India', 'India', 'India', 'India', 'India', 'India', 'India', 'India']","['India', 'India', 'India', 'India', 'India', 'India', 'India', 'India']"
0,[numpy.datetime64('2022-01-12T20:51:34.000000000')],[1481368276349378566],['The shadows of the capital'],[[]],['https://twitter.com/user/status/1481368276349378566'],['Doctor Protest'],0,2,['null'],['doctor'],['NEGATIVE'],"[{0: 'oxford attack tr reason doctor', 1: 'peopl tr doctor oxford attack', 2: 'attack oxford peopl tr protest', 3: 'attack tr protest peopl doctor', 4: 'peopl doctor oxford reason protest'}]",the people who attack doctors in the us don t protest against tr . oxford is the only one to protest against the attack . it is the same reason that the people that attack doctors don't protest .,['United States'],['United States']
0,"[numpy.datetime64('2022-01-15T21:07:13.000000000'), numpy.datetime64('2022-01-10T18:24:55.000000000')]","[1482459377722597377, 1480606595788808203]","['Footscray, Melbourne', 'cardiff ']","[[], []]","['https://twitter.com/user/status/1482459377722597377', 'https://twitter.com/user/status/1480606595788808203']","['Doctor Strikes', 'Doctor Strikes']",0,4,"['null', 'null']","['doctor', 'doctor']","['NEGATIVE', 'POSITIVE']","[{0: 'caus 17 point dumb free', 1: 'covid doctor dumb occur point', 2: 'occur england free doctor covid', 3: 'doctor death england dumb point', 4: 'england death 300 occur caus'}, {0: 'junior doctor uk strike guy', 1: 'minus uk guy junior doctor', 2: 'doctor junior minus uk overtim', 3: 'doctor uk overtim minus guy', 4: 'minus guy junior strike overtim'}]",a free dumb doctor in england points out that only 17 300 deaths have occurred in which covid was the only caus...who do guys on strikes that is more than a junior doctor minus overtime . covid is the only doctor in the uk .,"['England, United Kingdom', 'United Kingdom']","['United Kingdom', 'United Kingdom']"
0,[numpy.datetime64('2022-01-10T00:20:37.000000000')],[1480333722054496259],['Land stolen from the Tunica'],[[]],['https://twitter.com/user/status/1480333722054496259'],['Doctor Strikes'],0,7,['null'],['doctor'],['NEGATIVE'],"[{0: 'goy antisemit romania strike poland', 1: 'plot romania antisemit russia noth', 2: 'antisemit doctor white russia poland', 3: 'strike russia doctor white antisemit', 4: 'strike poland romania antisemit noth'}]",white goy strikes again romania poland russia doctor s plot nothing there is no antisemit... he is a russian doctor . he has been accused of plotting to kill a romanian doctor in a bid to kill him .,"['Village of Poland, Town of Russia, Herkimer County, New York, United States']",['Poland']
